{
  "schemaVersion": "1.0",
  "releaseId": "rel_01JQXK0000000000000000002",
  "runId": "run-a",
  "destination": "destination-a",
  "operation": "visibility-transition",
  "idempotencyKey": "run-a:destination-a:visibility-transition",
  "status": "failed",
  "remoteId": "remote-a",
  "remoteUrl": "https://destination-a.example/items/remote-a",
  "inputHashes": ["b2c3d4e5f60718293a4b5c6d7e8f901a2b3c4d5e6f708192a3b4c5d6e7f801a2"],
  "completedAt": "2026-01-01T00:05:00.000Z",
  "error": {
    "code": "ALDUS_EXAMPLE_FAILURE",
    "category": "io",
    "message": "The stage could not read its declared input.",
    "retryable": true
  }
}
